company,location,title,post_date,description,url,full_desc,seniority_level,employment_type,job_function,industries
Fulcrum Consulting,"Atlanta, Georgia",Business Analyst,2019-07-30,The Business Analyst job family defines skills for formulating and defining system scope using information technology and industry ...,https://www.linkedin.com/jobs/view/business-analyst-at-fulcrum-consulting-1403297542?position=9&pageNum=0&trk=guest_job_search_job-result-card_result-card_full-click,"Fulcrum ConsultingAtlanta, Georgia 
Easily apply to this job by creating a LinkedIn profile. This will only take about 3 minutes. 
Sign in to apply for this job with your LinkedIn profile. 
We will use your resume to quickly build your profile and apply to this job. 
Easily apply to this job by creating a LinkedIn profile. This will only take about 3 minutes. 
Sign in to apply for this job with your LinkedIn profile. 
We will use your resume to quickly build your profile and apply to this job. 
Qualifications:6 + years of experience required. Highly preferred strong business process / business re-engineering skill/experience. Experience for Documentum file storage and scanning processes and familiar with OCR documents. Ability to work with multiple business departments in a self-driven environment.     
  
 Responsibilities: The Business Analyst job family defines skills for formulating and defining system scope using information technology and industry knowledge/requirements, based on both user needs and a good understanding of information technology, business processes, and industry requirements. The job progression identifies responsibilities ranging from assisting, formulating and defining systems scope and objectives to self-directed activities that result in client’s long term improvements in business processes. '-Provides BU Support, resolving issues not requiring extensive business / system knowledge. -Communicates incident status / clarifies issues with business partner. -Escalates incidents to seniors where business process and extensive system knowledge is required. -Resolves application incidents and problems that require app code and/or op modifications such as lower complexity software problem resolution, training issues and documentation, and data problems requiring moderate business analysis, extensive business, and/or system knowledge. '-Responsible for a liaison role between the business and IT services providers to ensure functional specs are understood and they have what they need to develop their tech specs. -Analyzes issues to be solved within an enterprise and helps provide solutions to meet the desired business outcomes through the use of IT -Understands and documents business requirements and user requirements to ensure system designs meets business needs. -Ensures knowledge transfer to the support organization occurs prior to system go-live. -Schedules and communicates the system go-live date. -Develops and/or update documentations and training materials. -Ensures IT and SOX compliance is covered. -Documents functional requirements that describe the system, process, or product to fulfill business requirements. '-Responsible for functional design of application systems across all technologies and platforms. -Translates user requirements to process and data requirements. -Converts specifications about business problems into sequence of detailed programming instructions to solve business problems through automation support. -Constructs program flow charts to describe the processing of data and development of precise steps and processing logic across all platforms. -Provides broad understanding of platforms and applications across all technologies. -Functions as an IT advisor to the business units. -Oversees and guides the team of Business Analysts I, II  
",Mid-Senior level,Contract,Information Technology,"Information Technology and Services, Airlines/Aviation"
Urjanet,"Atlanta, GA, US",Business Analyst,2019-07-08,Desired Skills & Experience. Excellent verbal and written communications skills are a must for both internal communication and ...,https://www.linkedin.com/jobs/view/business-analyst-at-urjanet-1363044285?position=10&pageNum=0&trk=guest_job_search_job-result-card_result-card_full-click,"UrjanetAtlanta, GA, US 
",Associate,Full-time,"Business Development, Sales","Information Technology and Services, Computer Software, Internet"
Kelly Services,"Roswell, GA, US",Business Analyst,2019-07-20,"Our client, an American multinational personal care corporation, is currently seeking a Business Analyst for a 5 month temporary position...",https://www.linkedin.com/jobs/view/business-analyst-at-kelly-services-1382835331?position=11&pageNum=0&trk=guest_job_search_job-result-card_result-card_full-click,"Kelly ServicesRoswell, GA, US 
",Associate,Temporary,"Business Development, Sales","Construction, Staffing and Recruiting, Hospital & Health Care"
Experience LLC,"Atlanta, GA, US",INWEGO Business Analyst,2019-07-17,"We are looking for a Business Analyst to lead & own INWEGO’s efforts to measure, analyze & capitalize on the data we collect from ...",https://www.linkedin.com/jobs/view/inwego-business-analyst-at-experience-llc-1383932066?position=12&pageNum=0&trk=guest_job_search_job-result-card_result-card_full-click,"Experience LLCAtlanta, GA, US 
",Associate,Full-time,"Business Development, Sales",Entertainment
The Global Associates,"Smyrna, GA, US",Business Analyst,2019-06-16,"They manage the requirements development process through the elicitation, analysis, specification and verification of multiple levels of ...",https://www.linkedin.com/jobs/view/business-analyst-at-the-global-associates-1326863676?position=13&pageNum=0&trk=guest_job_search_job-result-card_result-card_full-click,"The Global AssociatesSmyrna, GA, US 
",Associate,Full-time,"Business Development, Sales","Information Technology and Services, Computer Software, Management Consulting"
Lincoln Property Company,"Atlanta, GA, US",Business Analyst,2019-07-21,"Au sein d’une équipe dynamique, vous relèverez de la Directrice Nationale de la ligne d’affaires Recrutement Conseil et travaillerez ...",https://www.linkedin.com/jobs/view/business-analyst-at-lincoln-property-company-1384965485?position=14&pageNum=0&trk=guest_job_search_job-result-card_result-card_full-click,"Lincoln Property CompanyAtlanta, GA, US 
",Associate,Full-time,"Business Development, Sales","Construction, Real Estate, Hospitality"
Imerys,"Roswell, Georgia",Business Analyst,2019-08-01,"Others: strategic thinking, interpersonal skills, ability to propose solutions. Minimum 5 years’ experience in a finance related role. ...",https://www.linkedin.com/jobs/view/business-analyst-at-imerys-1334246696?position=15&pageNum=0&trk=guest_job_search_job-result-card_result-card_full-click,"ImerysRoswell, Georgia 
Based at IMERYS  N America headquarters in Roswell, GA, the Business Analyst will support and provide input to the sales team to ensure the alignment of the group strategy and sales performance, and to deliver the business targets and customer satisfaction for the Paper and Board Business area.  
  
Responsibilities:  
Business partner to VP and their team  
Responsible for liaising with the consolidations team for the P&L management  
Provide predictive analysis to support sales forecasting in cooperation with demand planning  
Provide adhoc analysis based on the available data on a wide 'control tower' scope  
Run analysis for sales management (rebate schemes, price negotiations..)  
Support commercial roadmap (Salesforce, quotations) & Capital investment justification  
Support project execution (planning, revised budget)  
Produce Sales KPIs – Sales: volume / price / mix analysis; Order book, Book to Bill, standard gross margin  
Analyze Competitors and market performance  
   
Background & Experience:  
Bachelor’s degree in Business/Finance  
Minimum 5 years’ experience in a finance related role  
Strong quantitative and analytical capabilities  
Strategic understanding of sales topics  
Financial competencies  
Others: strategic thinking, interpersonal skills, ability to propose solutions  
Data warehouse experience a plus  
Strategy experience is added advantage  
  
IMERYS... Mineral Solutions to create tomorrow's world.  Imerys is a Paris based Global Leader, who transforms minerals into thousands of high valued specialty mineral products essential for our Customers' Products.  
   
IMERYS offers competitive benefits including medical/dental insurance, 401K matching and paid vacation.  
  
Check Imerys out on Youtube: https://www.youtube.com/watch?v=7jaEhgwzfxk 
",Mid-Senior level,Full-time,"Strategy/Planning, Analyst, General Business",Mining & Metals
DCM Data Systems,"Atlanta, GA, US",Business Analyst,2019-07-23,Declarative Salesforce Configuration experience (nCino Experience is preferred) Experience working in Financial Services. Run effective ...,https://www.linkedin.com/jobs/view/business-analyst-at-dcm-data-systems-1389730366?position=16&pageNum=0&trk=guest_job_search_job-result-card_result-card_full-click,"DCM Data SystemsAtlanta, GA, US 
",Associate,Full-time,"Business Development, Sales","Information Technology and Services, Computer Software, Computer & Network Security"
AMNAH TRADING LLC,"Marietta, GA, US",Business Analyst,2019-06-24,"Arthur Lawrence is urgently looking for Business Analyst for a contract role in Marietta, GA. 5+ years of experience with Visio, MS ...",https://www.linkedin.com/jobs/view/business-analyst-at-amnah-trading-llc-1340907992?position=17&pageNum=0&trk=guest_job_search_job-result-card_result-card_full-click,"AMNAH TRADING LLCMarietta, GA, US 
",Associate,Contract,"Business Development, Sales","Information Technology and Services, Computer Software, Staffing and Recruiting"
JLL,"Atlanta, GA, US",Business Analyst,2019-08-01,"The role requires a high energy, intellectually curious, detail oriented professional with excellent time management, research, content ...",https://www.linkedin.com/jobs/view/business-analyst-at-jll-1405778243?position=18&pageNum=0&trk=guest_job_search_job-result-card_result-card_full-click,"JLLAtlanta, GA, US 
",Associate,Full-time,"Business Development, Sales","Management Consulting, Financial Services, Real Estate"
The Home Depot,"Atlanta, GA, US",Operations Business Analyst (131808),2019-07-24,"Identify, distinguish and analyze multiple components of a problem and then make conclusions using high-level quantitative skills to help...",https://www.linkedin.com/jobs/view/operations-business-analyst-131808-at-the-home-depot-1392405101?position=19&pageNum=0&trk=guest_job_search_job-result-card_result-card_full-click,"The Home DepotAtlanta, GA, US 
",Associate,Full-time,"Business Development, Sales","Construction, Retail, Financial Services"
Georgia United Credit Union,"Duluth, GA, US",Business Analyst,2019-07-31,"Elicit requirements using interviews, document analysis, surveys, site visits, business process descriptions, use cases, scenarios, ...",https://www.linkedin.com/jobs/view/business-analyst-at-georgia-united-credit-union-1405765808?position=20&pageNum=0&trk=guest_job_search_job-result-card_result-card_full-click,"Georgia United Credit UnionDuluth, GA, US 
",Associate,Full-time,"Business Development, Sales","Nonprofit Organization Management, Banking, Financial Services"
apninccom,"Norcross, GA, US",Business Analyst,2019-07-31,As Business Analyst you will be responsible for driving the Digitalization of finance processes in the Business Unit in close cooperation...,https://www.linkedin.com/jobs/view/business-analyst-at-apninccom-1405072302?position=21&pageNum=0&trk=guest_job_search_job-result-card_result-card_full-click,"apninccomNorcross, GA, US 
",Associate,Full-time,"Business Development, Sales","Electrical/Electronic Manufacturing, Computer Software, Machinery"
IF THEN,"Atlanta, GA, US",Business Analyst,2019-07-31,"If/Then, based in Atlanta, is looking for a Business Analyst focusing on developing technical and user experience requirements documents ...",https://www.linkedin.com/jobs/view/business-analyst-at-if-then-1405053898?position=22&pageNum=0&trk=guest_job_search_job-result-card_result-card_full-click,"IF THENAtlanta, GA, US 
",Associate,Full-time,"Business Development, Sales","Marketing and Advertising, Information Technology and Services, Computer Software"
DRT Strategies,"Atlanta, GA, US",Business Analyst,2019-07-19,"Experience with the principles of exercising independent judgment, as well as a high level of analytical skills, in solving complex ...",https://www.linkedin.com/jobs/view/business-analyst-at-drt-strategies-1381103797?position=23&pageNum=0&trk=guest_job_search_job-result-card_result-card_full-click,"DRT StrategiesAtlanta, GA, US 
",Associate,Full-time,"Business Development, Sales","Information Technology and Services, Management Consulting, Financial Services"
Canpango,"Atlanta, GA, US",Business Analyst,2019-06-16,"Excellent verbal and written communication skills and the ability to interact professionally with a diverse group of executives, managers...",https://www.linkedin.com/jobs/view/business-analyst-at-canpango-1349658509?position=24&pageNum=0&trk=guest_job_search_job-result-card_result-card_full-click,"CanpangoAtlanta, GA, US 
",Associate,Full-time,"Business Development, Sales","Information Technology and Services, Computer Software, Management Consulting"
HatchWorks,"Atlanta, GA, US",Business Analyst,2019-07-05,Strong analytical and problem-solving skills with a preference for candidates with SQL experience. HatchWorks Technologies is currently ...,https://www.linkedin.com/jobs/view/business-analyst-at-hatchworks-1402751148?position=25&pageNum=0&trk=guest_job_search_job-result-card_result-card_full-click,"HatchWorksAtlanta, GA, US 
",Associate,Full-time,"Business Development, Sales","Information Technology and Services, Computer Software, Management Consulting"
Compri Consulting,"Hillsboro, Oregon",Business Analyst,2019-07-31,"Compri Consulting is seeking a Senior Business Analyst for our Hillsboro, OR, client. Expert SQL skills - Complex SQL coding. 6+ years of...",https://www.linkedin.com/jobs/view/business-analyst-at-compri-consulting-1393446155?position=1&pageNum=0&trk=guest_job_search_job-result-card_result-card_full-click,"Compri ConsultingHillsboro, Oregon 
 
Compri Consulting is seeking a Senior Business Analyst for our Hillsboro, OR, client.  This contract opportunity is scheduled to be 1-year.  
Required Skills:  
",Mid-Senior level,Contract,Analyst,Hospital & Health Care
EdgeLink,"Hillsboro, Oregon",Business Analyst,2019-07-26,Ideal candidates will have some previous financial domain experience and have a passion for acting as a liaison between technical and ...,https://www.linkedin.com/jobs/view/business-analyst-at-edgelink-1349653590?position=2&pageNum=0&trk=guest_job_search_job-result-card_result-card_full-click,"EdgeLinkHillsboro, Oregon 
 
Title: Business Analyst      
  
Location: Hillsboro, OR  
  
Employment Type: Contract to Hire        
  
Job Description:  
Edgelink is looking for a Business Analyst to join an enterprise team that is currently building a number of mobile and web applications for the financial industry. Ideal candidates will have some previous financial domain experience and have a passion for acting as a liaison between technical and business teams.  From an experience perspective, we are targeting candidates with most of the following:  
  
  
EdgeLink would like to thank all applicants, however only those who qualify for an interview will be contacted.  
  
EdgeLink is an equal opportunity employer. 
",Mid-Senior level,Full-time,"Engineering, Information Technology","Information Technology and Services, Computer Software, Internet"
Indaba Systems,"Vancouver, WA, US",Business Analyst,2019-07-24,Indaba Systems is seeking a business analyst with experience in the textbook and/or ecommerce industries. This position is responsible ...,https://www.linkedin.com/jobs/view/business-analyst-at-indaba-systems-1390820514?position=3&pageNum=0&trk=guest_job_search_job-result-card_result-card_full-click,"Indaba SystemsVancouver, WA, US 
Easily apply to this job by creating a LinkedIn profile. This will only take about 3 minutes. 
Sign in to apply for this job with your LinkedIn profile. 
We will use your resume to quickly build your profile and apply to this job. 
Easily apply to this job by creating a LinkedIn profile. This will only take about 3 minutes. 
Sign in to apply for this job with your LinkedIn profile. 
We will use your resume to quickly build your profile and apply to this job. 
",Associate,Full-time,"Business Development, Sales","Information Technology and Services, Computer Software, Internet"
CorSource,"Vancouver, Washington",Business Analyst,2019-08-01,"The ideal candidate should enjoy working under pressure and timelines, while maintaining accuracy and excellent records management. ...",https://www.linkedin.com/jobs/view/business-analyst-at-corsource-1395316798?position=4&pageNum=0&trk=guest_job_search_job-result-card_result-card_full-click,"CorSourceVancouver, Washington 
Position Overview:  
This full-time contract Business Analyst 2 position is a part of our client's Transmission Account Services (TSES) organization. TSES provides technical expertise and support to the Account Executives (AEs) for Transmission customer issues, including contract development and finalization, quality control review of Transmission contracts, analysis, customer issue resolution and front office contract administration. This position facilitates daily coordination and program support related to administration of fee receipt and refund, documentation and reconciliation of customer accounts, clarification of established fee-related policies to internal and external customers, and associated liaison activities with Transmission internal and external customers. In conjunction with Transmission Services (TS), this position will coordinate with a Transmission Account Executive (AE) Customer Account Team and with our client's representatives to facilitate resolution and routine management of customer accounts and issues. The position will coordinate the implementation of contract templates, provide a liaison function with Customer Support Services, coordinate the Transmission Service application process with customers, provide Open Access Same-Time Information Systems (OASIS) support and will be responsible for supporting manual processes linked to all TS requests (i.e., rollover requests and competing requests).  
  
Organization & Culture:  
Candidates should be self-starters, motivated to work independently in a collaborative manner with their own team members and internal stakeholders.  The ideal candidate should enjoy working under pressure and timelines, while maintaining accuracy and excellent records management. Telework may be available one day a week to team members who are able to meet established timelines and assigned deliverables.  This position is very busy and resides in a fast paced environment.  Multi-tasking with the ability to adapt to change is essential.  There are compliance components to this position that make accountability very important.    
  
  
  
Requirements:  
  
Education & Corresponding Experience (required on matrix):  
  
Required Technical Skills & Experience (required on matrix):  
  
Additional Requirements (not required on matrix):  
  
PPE Requirements:  
  
Other Position Considerations:  
",Associate,Contract,Business Development,Utilities
ieSolutions,"Portland, OR, US",Business Analyst,2019-07-12,"Experience implementing process improvement changes in an organization, including making recommendations at a management level. Senior ...",https://www.linkedin.com/jobs/view/business-analyst-at-iesolutions-1368360196?position=5&pageNum=0&trk=guest_job_search_job-result-card_result-card_full-click,"ieSolutionsPortland, OR, US 
Easily apply to this job by creating a LinkedIn profile. This will only take about 3 minutes. 
Sign in to apply for this job with your LinkedIn profile. 
We will use your resume to quickly build your profile and apply to this job. 
Easily apply to this job by creating a LinkedIn profile. This will only take about 3 minutes. 
Sign in to apply for this job with your LinkedIn profile. 
We will use your resume to quickly build your profile and apply to this job. 
",Associate,Full-time,"Business Development, Sales","Information Technology and Services, Computer Software, Financial Services"
Kforce Inc,"Beaverton, OR, US",Business Analyst,2019-07-31,"Kforce has a client seeking a Business Analyst in Beaverton, OR. Understanding and experience in one or more Hot Skill Technology (Java, ...",https://www.linkedin.com/jobs/view/business-analyst-at-kforce-inc-1404281609?position=6&pageNum=0&trk=guest_job_search_job-result-card_result-card_full-click,"Kforce IncBeaverton, OR, US 
",Associate,Contract,"Business Development, Sales","Media Production, Online Media, Program Development"
InterProse,"Vancouver, WA, US",Business Analyst,2019-07-31,"Due to continued growth, The InterProse Corporation is looking for the next great addition to our team. Strong research skills; ...",https://www.linkedin.com/jobs/view/business-analyst-at-interprose-1404670648?position=7&pageNum=0&trk=guest_job_search_job-result-card_result-card_full-click,"InterProseVancouver, WA, US 
",Associate,Full-time,"Business Development, Sales",Computer Software
Interprose - A Strategic Communications Company,"Vancouver, WA, US",Business Analyst,2019-07-30,"Due to continued growth, The InterProse Corporation is looking for the next great addition to our team. Strong research skills; ...",https://www.linkedin.com/jobs/view/business-analyst-at-interprose-a-strategic-communications-company-1403580366?position=8&pageNum=0&trk=guest_job_search_job-result-card_result-card_full-click,"Interprose - A Strategic Communications CompanyVancouver, WA, US 
",Associate,Full-time,"Business Development, Sales","Construction, Information Technology and Services, Computer Software"
Jobs @ TheJobNetwork,"Portland, OR, US",Business Analyst,2019-08-02,"As we continue to grow and deepen our impact on organizations around the world, we are looking for the right people to join us on our ...",https://www.linkedin.com/jobs/view/business-analyst-at-jobs-%40-thejobnetwork-1406604114?position=9&pageNum=0&trk=guest_job_search_job-result-card_result-card_full-click,"Jobs @ TheJobNetworkPortland, OR, US 
",Associate,Full-time,"Business Development, Sales",Marketing and Advertising
Epiq,"Beaverton, OR, US",Business Systems Analyst,2019-07-31,"The Business System Analyst (BSA) is responsible for understanding the requirements for a particular case, or step of a case, and ...",https://www.linkedin.com/jobs/view/business-systems-analyst-at-epiq-1405128741?position=10&pageNum=0&trk=guest_job_search_job-result-card_result-card_full-click,"EpiqBeaverton, OR, US 
",Associate,Full-time,Information Technology,"Staffing and Recruiting, Legal Services, Financial Services"
Kaiser Permanente,"Portland, OR, US",Business Analyst,2018-11-18,"Business analysis or project analysis experience. Is assigned to investigate, document, and analyze client requirements in project areas ...",https://www.linkedin.com/jobs/view/business-analyst-at-kaiser-permanente-972739297?position=11&pageNum=0&trk=guest_job_search_job-result-card_result-card_full-click,"Kaiser PermanentePortland, OR, US 
",Associate,Full-time,"Business Development, Sales","Financial Services, Health, Wellness and Fitness, Hospital & Health Care"
CMC LTD,"Hillsboro, OR, US",Business Analyst,2019-07-31,"Ideally you will also have quality or manufacturing experience, so you can quickly & accurately understand business processes and the ...",https://www.linkedin.com/jobs/view/business-analyst-at-cmc-ltd-1405066155?position=12&pageNum=0&trk=guest_job_search_job-result-card_result-card_full-click,"CMC LTDHillsboro, OR, US 
",Associate,Full-time,"Business Development, Sales","Marketing and Advertising, Management Consulting, Consumer Services"
Moda Health,"Portland, OR, US",Business Systems Analyst - IT Projects,2019-07-16,"Together, we can be more. We can be better. We are seeking a full time Business Systems Analyst that would participate in Systems ...",https://www.linkedin.com/jobs/view/business-systems-analyst-it-projects-at-moda-health-1374921005?position=13&pageNum=0&trk=guest_job_search_job-result-card_result-card_full-click,"Moda HealthPortland, OR, US 
",Associate,Full-time,Information Technology,"Insurance, Financial Services, Hospital & Health Care"
"New Relic, Inc.","Portland, OR, US",Business Process Analyst,2019-06-19,"In collaboration with Support management, you will prioritize process and workflow design efforts based on business value in order to ...",https://www.linkedin.com/jobs/view/business-process-analyst-at-new-relic-inc-1333919088?position=14&pageNum=0&trk=guest_job_search_job-result-card_result-card_full-click,"New Relic, Inc.Portland, OR, US 
",Associate,Full-time,"Information Technology, Customer Service, Engineering","Computer Software, Internet"
