company,location,title,post_date,description,url,full_desc,seniority_level,employment_type,job_function,industries
Infosys,"Bellevue, Washington",Business Analyst,2019-08-01,"Experience in driving meetings/workshops with senior client executives, business leads & cross functional stakeholders and articulate ...",https://www.linkedin.com/jobs/view/business-analyst-at-infosys-1405733275?position=1&pageNum=0&trk=guest_job_search_job-result-card_result-card_full-click,"InfosysBellevue, Washington 
Easily apply to this job by creating a LinkedIn profile. This will only take about 3 minutes. 
Sign in to apply for this job with your LinkedIn profile. 
We will use your resume to quickly build your profile and apply to this job. 
Easily apply to this job by creating a LinkedIn profile. This will only take about 3 minutes. 
Sign in to apply for this job with your LinkedIn profile. 
We will use your resume to quickly build your profile and apply to this job. 
  
 Basic Requirements• Bachelor’s degree or foreign equivalent required from an accredited institution. Will also consider three years of progressive experience in the specialty in lieu of every year of education.• At least 4 years of IT experience.Preferred • Extensive experience in below areas: o Strong knowledge in end to end mortgage finance lifecycle from Originations to Termination o Strong domain knowledge in auto motive finance / equipment leasing o End-to-End solution customization and Implementation experience in product or custom-built software• Work with Agile scrum team, to analyse the prioritized user stories to define the sprint scope• Understand interface / integration technologies and a good understanding of customers’ needs so they can be translated into requirements• Perform Functional Testing, Assist in System Integration Testing (SIT), & Support during UAT• Review SIT/UAT/BST test cases and conduct SIT along with tester• Drive business workshops to define requirements and elaborate functional specifications of an IT solution• Design Business User Stories, Use cases, Lead Functional Architecture, Re-engineer process models and Integrate disparate services for end to end solution delivery• Experience with industry standard COTS products in Auto Finance industry (e.g. White Clarke, Cassiopae, Fiserv, etc.)• Knowledge of Accounting concepts related to accruals, depreciation, Asset Based Accounting• Exposure to allied areas such as finance & treasury, risk & controlling and key financial reports• Complete understanding of requirements gathering in discussion with product owner• Experience in working across teams in consulting, software development, product support, quality assurance. • Experience in working in a global environment with multiple locations• Experience in driving meetings/workshops with senior client executives, business leads & cross functional stakeholders and articulate project documents lucidly • Excellent soft skills - written and verbal communication• Exposure to / knowledge of latest digital trends (big data, analytics, social media) & their impact on domain area• Ability to understand and use advance analysis methods in slightly complex client scenarios to ensure problem areas are identified and impact on the business is understood• Ability to work across project lifecycle, and adopt Agile practices• Demonstrated skill in a sales or pre sales role is a plus• Global exposure to a multi-cultural organization structure• Preferably should have an exposure to outsourcing and offshoring work models 
",Mid-Senior level,Full-time,"Engineering, Information Technology",Information Technology and Services
ThreeBridge Solutions,Greater Minneapolis-St. Paul Area,Business Analyst,2019-07-31,6-7 years of experience required: Business Analysis in Financial Services and/or Insurance Industry; demonstrated accomplishments in ...,https://www.linkedin.com/jobs/view/business-analyst-at-threebridge-solutions-1404942998?position=2&pageNum=0&trk=guest_job_search_job-result-card_result-card_full-click,"ThreeBridge SolutionsGreater Minneapolis-St. Paul Area 
NO VISA SPONSORSHIP AVAILABLE FOR THIS ROLE  
  
Liaison with key Business Stakeholders and IT in the analysis and delivery of enhancements, projects and products. Executes, with advanced ability, assessing and documenting business risks, creating business cases, identifying impacted stakeholders, developing communication plans, creating As Is/To Be process flows, facilitating and documenting gap analysis, and facilitating JAR sessions. Responsible, with expert ability, of multiple business requirement elicitation methods, assessing business impacts, writing clear, concise, and accurate business requirements, business requirement peer reviews, business requirement traceability to technical requirements, planning/coordination/ execution of User Acceptance Testing, production validation, training/SOP support, and project transition planning. Provides mentorship and guidance to other business analysts. Must possess expert knowledge level in one business line with an intermediate understanding of the other business lines.  
   
RESPONSIBILITIES  
   
REQUIREMENTS  
",Mid-Senior level,Contract,Management,Management Consulting
Optiontown,"Boston, Massachusetts",Business Analyst,2019-07-25,"Software Analysts will leverage their analytic, quantitative and technological skills to derive insights and solve problems. Collaborate ...",https://www.linkedin.com/jobs/view/business-analyst-at-optiontown-1393725993?position=3&pageNum=0&trk=guest_job_search_job-result-card_result-card_full-click,"OptiontownBoston, Massachusetts 
Job Title: Software Analyst / Business Analyst  
Department: Product Design / Revenue Management  
Roles & Responsibilities:  
 Analysts are active participants in creating and delivering solutions for e-commerce products and project teams. Software Analysts will leverage their analytic, quantitative and technological skills to derive insights and solve problems. In particular, Software Analysts employ advanced analytic techniques to create advanced e-commerce front-ends.  
As a Software Analyst, your role will be multi-dimensional, such as:  
Prepare detailed functional requirements and create product requirement (PRDs) and other documents to support rapid development and effectively manage trade-offs between schedules versus customer benefits.  
Gain immediate responsibility for project deliverables.  
Design algorithms for enhancement of existing and future e-commerce products.  
Establish price intelligence, demand forecasting and competitive intelligence process for existing products.  
Leverage optimization techniques to guide clients and have competitive pricing.  
Work with other teams to manage operational issues of online products.  
Ensure Requirements and user flows are properly translated to live site and drive problem resolution during User Acceptance Testing.  
Rigorously monitor key performance metrics and coordinate with various teams to take corrective actions.  
Collaborate with technology team to develop a deep understanding of online products, identify gaps in core product functionality and help build right set of features and track adoption.  
Apply digital marketing techniques to increase reach of Optiontown products. Provide analytic s based insights to help marketing team optimize marketing goals. Engage in defining a strategic creative direction for product and marketing communications.  
  
Education - Bachelors Degree in any field  
Salary     - Base Salary + Revenue Based Bonus + Stock Options (best in the industry)  
Contact   - Send Resume and CoverLetter to hr@optiontown.com 
",Entry level,Full-time,"Analyst, Product Management, Strategy/Planning",Airlines/Aviation
"Four51, Inc.",Greater Minneapolis-St. Paul Area,Business Analyst,2019-07-22,"The ideal candidate will have: Four51 provides competitive marketplace salary compensation, profit sharing, and provides our employees ...",https://www.linkedin.com/jobs/view/business-analyst-at-four51-inc-1345805864?position=4&pageNum=0&trk=guest_job_search_job-result-card_result-card_full-click,"Four51, Inc.Greater Minneapolis-St. Paul Area 
Imagine sitting in the drivers’ seat, helping to accelerate digital transformation for some of the world’s most well-known brands.  
   
At Four51, you can.  
  
Inspired by the temperature at which paper burns (451°), Four51 is dedicated to shattering antiquated business processes and out-innovating the limitations of eCommerce.  
  
We develop true partnerships with our clients that allow us to deliver digital transformation through customizable and scalable eCommerce, order management and digital marketplace solutions that connect the unconnected and solve the impossible.  
  
We believe that by constantly re-imagining the boundaries of connectivity, speed and flexibility, we can connect our partners to their customers in ways they had only dreamed of, dramatically changing the economics of their businesses.  
  
JOB SUMMARY:  
  
Business Analysts at Four51 take on the most challenging and sophisticated problems in B2B and B2B2C eCommerce, and work alongside our customers and partners  - well-known brands including Starbucks, Chipotle, Aveda, Winmark and many more - to help develop solutions. As a Business Analyst, you understand our customers inside out, and you’re able to translate their realities to our developers to help imagine how eCommerce could transform the way they do business.  
  
As a Business Analyst, your day-to-day includes:  
  
QUALIFICATIONS:  
  
The ideal candidate will have:  
  
Four51 provides competitive marketplace salary compensation, profit sharing, and provides our employees with a challenging workplace team with smart, experienced individuals to help you grow and develop.  We offer a competitive benefits package including health and dental insurance, 401(k) with a match, life and disability insurance, paid time off, flexible workplace philosophy, state-of-the-art technology, and an outstanding workplace environment in the North Loop/Warehouse District downtown Minneapolis.  We will push you to become your best, and reward you for outstanding work.    
  
Four51 is an equal opportunity employer and does not discriminate with regard to race, color, national origin, age, religion, disability, gender, gender identity or expression, sexual orientation, pregnancy, genetic information, familial status, marital status, military status, or any other characteristics protected by federal, state, and local applicable fair employment practices laws. 
",Entry level,Full-time,Information Technology,Internet
Exelon,"Baltimore, MD, US",Business Analyst,2019-07-26,"G. , asset management, electric or gas operations, customer service, transmission and substation, distribution system operations, ...",https://www.linkedin.com/jobs/view/business-analyst-at-exelon-1395828149?position=5&pageNum=0&trk=guest_job_search_job-result-card_result-card_full-click,"ExelonBaltimore, MD, US 
",Associate,Full-time,"Business Development, Sales","Construction, Oil & Energy, Utilities"
"Attain, LLC","Washington, D.C., DC, US",Business Analyst,2019-07-25,"What You Will Do. Must have good time management skills and ability to multi-task, able to adapt to new requirements and readjust as ...",https://www.linkedin.com/jobs/view/business-analyst-at-attain-llc-1394164602?position=6&pageNum=0&trk=guest_job_search_job-result-card_result-card_full-click,"Attain, LLCWashington, D.C., DC, US 
",Associate,Full-time,"Business Development, Sales","Information Technology and Services, Computer Software, Computer & Network Security"
HCA Healthcare,"Brentwood, TN, US",Business Analyst,2019-07-24,"Our mission at PSG is to practice the best medicine, produce superior patient experiences, achieve operational excellence and collaborate...",https://www.linkedin.com/jobs/view/business-analyst-at-hca-healthcare-1393239953?position=7&pageNum=0&trk=guest_job_search_job-result-card_result-card_full-click,"HCA HealthcareBrentwood, TN, US 
",Not Applicable,Full-time,"Business Development, Sales",Hospital & Health Care
certified management group,"Stamford, CT, US",Business Analyst,2019-07-24,The Business Analyst is responsible for supporting the Convenience Selling (Account Executive) team and enabling them to achieve sales ...,https://www.linkedin.com/jobs/view/business-analyst-at-certified-management-group-1391783291?position=8&pageNum=0&trk=guest_job_search_job-result-card_result-card_full-click,"certified management groupStamford, CT, US 
Easily apply to this job by creating a LinkedIn profile. This will only take about 3 minutes. 
Sign in to apply for this job with your LinkedIn profile. 
We will use your resume to quickly build your profile and apply to this job. 
Easily apply to this job by creating a LinkedIn profile. This will only take about 3 minutes. 
Sign in to apply for this job with your LinkedIn profile. 
We will use your resume to quickly build your profile and apply to this job. 
",Associate,Full-time,"Business Development, Sales","Consumer Goods, Financial Services, Accounting"
Agiloft,"Salt Lake City, UT, US",Business Analyst,2019-07-23,"The ideal candidate must have solid critical thinking and problem-solving skills, strong business acumen, and excellent written and ...",https://www.linkedin.com/jobs/view/business-analyst-at-agiloft-1389930654?position=9&pageNum=0&trk=guest_job_search_job-result-card_result-card_full-click,"AgiloftSalt Lake City, UT, US 
",Associate,Full-time,"Business Development, Sales","Information Technology and Services, Computer Software, Financial Services"
Winsor Group,"Farmingdale, NY, US",Business Analyst,2019-07-24,"Winsor Consult Group is looking for an enthusiastic, skilled Business Analyst to become an integral part of our reporting team in ...",https://www.linkedin.com/jobs/view/business-analyst-at-winsor-group-1391246173?position=10&pageNum=0&trk=guest_job_search_job-result-card_result-card_full-click,"Winsor GroupFarmingdale, NY, US 
Easily apply to this job by creating a LinkedIn profile. This will only take about 3 minutes. 
Sign in to apply for this job with your LinkedIn profile. 
We will use your resume to quickly build your profile and apply to this job. 
Easily apply to this job by creating a LinkedIn profile. This will only take about 3 minutes. 
Sign in to apply for this job with your LinkedIn profile. 
We will use your resume to quickly build your profile and apply to this job. 
",Associate,Full-time,"Business Development, Sales","Construction, Government Administration, Financial Services"
University of North Carolina at Chapel Hill,"Chapel Hill, NC, US",Business Analyst,2019-07-26,"This position is responsible for managing the selection, testing and installation of business systems for Energy Services, along with the...",https://www.linkedin.com/jobs/view/business-analyst-at-university-of-north-carolina-at-chapel-hill-1395453016?position=11&pageNum=0&trk=guest_job_search_job-result-card_result-card_full-click,"University of North Carolina at Chapel HillChapel Hill, NC, US 
",Associate,Full-time,"Business Development, Sales","Nonprofit Organization Management, Higher Education, Education Management"
CorSource,"Vancouver, Washington",Business Analyst,2019-08-01,"The ideal candidate should enjoy working under pressure and timelines, while maintaining accuracy and excellent records management. ...",https://www.linkedin.com/jobs/view/business-analyst-at-corsource-1395316798?position=12&pageNum=0&trk=guest_job_search_job-result-card_result-card_full-click,"CorSourceVancouver, Washington 
Position Overview:  
This full-time contract Business Analyst 2 position is a part of our client's Transmission Account Services (TSES) organization. TSES provides technical expertise and support to the Account Executives (AEs) for Transmission customer issues, including contract development and finalization, quality control review of Transmission contracts, analysis, customer issue resolution and front office contract administration. This position facilitates daily coordination and program support related to administration of fee receipt and refund, documentation and reconciliation of customer accounts, clarification of established fee-related policies to internal and external customers, and associated liaison activities with Transmission internal and external customers. In conjunction with Transmission Services (TS), this position will coordinate with a Transmission Account Executive (AE) Customer Account Team and with our client's representatives to facilitate resolution and routine management of customer accounts and issues. The position will coordinate the implementation of contract templates, provide a liaison function with Customer Support Services, coordinate the Transmission Service application process with customers, provide Open Access Same-Time Information Systems (OASIS) support and will be responsible for supporting manual processes linked to all TS requests (i.e., rollover requests and competing requests).  
  
Organization & Culture:  
Candidates should be self-starters, motivated to work independently in a collaborative manner with their own team members and internal stakeholders.  The ideal candidate should enjoy working under pressure and timelines, while maintaining accuracy and excellent records management. Telework may be available one day a week to team members who are able to meet established timelines and assigned deliverables.  This position is very busy and resides in a fast paced environment.  Multi-tasking with the ability to adapt to change is essential.  There are compliance components to this position that make accountability very important.    
  
  
  
Requirements:  
  
Education & Corresponding Experience (required on matrix):  
  
Required Technical Skills & Experience (required on matrix):  
  
Additional Requirements (not required on matrix):  
  
PPE Requirements:  
  
Other Position Considerations:  
",Associate,Contract,Business Development,Utilities
EPITEC,"West Palm Beach, Florida Area",Business Analyst,2019-08-01,"Experience in managing enterprise data assets in a large, complex organization. Experience in the use of data catalogues and data quality...",https://www.linkedin.com/jobs/view/business-analyst-at-epitec-1394692278?position=13&pageNum=0&trk=guest_job_search_job-result-card_result-card_full-click,"EPITECWest Palm Beach, Florida Area 
Easily apply to this job by creating a LinkedIn profile. This will only take about 3 minutes. 
Sign in to apply for this job with your LinkedIn profile. 
We will use your resume to quickly build your profile and apply to this job. 
Easily apply to this job by creating a LinkedIn profile. This will only take about 3 minutes. 
Sign in to apply for this job with your LinkedIn profile. 
We will use your resume to quickly build your profile and apply to this job. 
JOB SUMMARY FOR BUSINESS ANALYST:  
   
   
   
RESPONSIBILITIES FOR BUSINESS ANALYST:  
   
   
   
REQUIRED EXPERIENCE FOR BUSINESS ANALYST:  
   
   
   
SKILLS AND QUALIFICATIONS FOR BUSINESS ANALYST:  
   
",Associate,Contract,"Information Technology, Business Development, Analyst","Renewables & Environment, Oil & Energy"
Sure Power Consulting,"Phoenix, Arizona Area",Business Analyst,2019-08-01,"Excellent written (including email) and oral communication (including telephone), and documentation skills. 1-2 years of work experience ...",https://www.linkedin.com/jobs/view/business-analyst-at-sure-power-consulting-1406309177?position=14&pageNum=0&trk=guest_job_search_job-result-card_result-card_full-click,"Sure Power ConsultingPhoenix, Arizona Area 
 
PHOENIX ARIZONA - LOCAL CANDIDATES ONLY  
Entry level Business Analyst contract position working with a large municipal client. This is a Full-Time Contract position with an expected duration of at least 1 year.  
   
Major Accountabilities:  
   
Position Requirements:  
",Entry level,Contract,"Administrative, Analyst, Information Technology","Utilities, Information Technology and Services"
Modis,"Erie, Pennsylvania Area",Business Analyst,2019-08-01,"Implements, configures, troubleshoots and maintains systems to support enhancements, process improvements, HR policy changes, regulatory ...",https://www.linkedin.com/jobs/view/business-analyst-at-modis-1406059320?position=15&pageNum=0&trk=guest_job_search_job-result-card_result-card_full-click,"ModisErie, Pennsylvania Area 
**No C2C  
**No Sponsorship Provided  
**Local Candidates Preferred (Erie, PA)  
  
6 month contract to hire  
-2+ years experience  
  
Description:  
Designs,   develops and modifies reports using human resources management systems (HRMS)   systems. Implements, configures, troubleshoots and maintains systems to   support enhancements, process improvements, HR policy changes, regulatory   changes and enhance the end user experience.  
",Mid-Senior level,Contract,Information Technology,Information Technology and Services
Launch Consulting Group,Greater St. Louis Area,Business Analyst,2019-07-30,We’re seeking a Business Analyst to assist in the collection and consolidation of client business information and data. We use ...,https://www.linkedin.com/jobs/view/business-analyst-at-launch-consulting-group-1389235645?position=16&pageNum=0&trk=guest_job_search_job-result-card_result-card_full-click,"Launch Consulting GroupGreater St. Louis Area 
Easily apply to this job by creating a LinkedIn profile. This will only take about 3 minutes. 
Sign in to apply for this job with your LinkedIn profile. 
We will use your resume to quickly build your profile and apply to this job. 
Easily apply to this job by creating a LinkedIn profile. This will only take about 3 minutes. 
Sign in to apply for this job with your LinkedIn profile. 
We will use your resume to quickly build your profile and apply to this job. 
BUSINESS ANALYST  
  
Be a part of our success story. Launch offers talented and motivated people the opportunity to do the best work of their lives in a dynamic and growing company. Through competitive salaries, outstanding benefits, internal advancement opportunities, and recognized community involvement, you'll have the chance to create a career you can be proud of. Your new trajectory starts here at Launch.  
  
We’re seeking a Business Analyst to assist in the collection and consolidation of client business information and data. This role will work with a Senior Business Analyst and Technical Program Manager to interface with our client stakeholders to document client organization direction, structure, business processes and requirements. The candidate must possess excellent communication skills and be capable of delivering support across a variety of projects.   
Responsibilities:  
  
   
Required Experience/Qualifications:  
  
We are Navigators in the Age of Transformation.  
  
We use sophisticated technology to transform clients to the digital age, but our positive impact on the human experience is our top priority. We ease anxiety and fear around digital transformation and replace it with opportunity.  
  
Qualified applicants, please respond to inquire@launchcg.com with your full name, resume, and a brief description of how your skills match the requirements above. Please refer to job #2846  
  
Launch Consulting is an Equal Opportunity and Affirmative Action employer. 
",Mid-Senior level,Full-time,Analyst,Information Technology and Services
MicroPact,"Herndon, VA, US",Business Analyst ,2019-07-31,At MicroPact we are looking for those who understand the challenges of translating business needs into technical reality. Very strong ...,https://www.linkedin.com/jobs/view/business-analyst-at-micropact-1393451762?position=17&pageNum=0&trk=guest_job_search_job-result-card_result-card_full-click,"MicroPactHerndon, VA, US 
",Mid-Senior level,Full-time,Information Technology,Information Technology and Services
