company,location,title,post_date,description,url,full_desc,seniority_level,employment_type,job_function,industries
Agoda,"Chicago, IL, US",Senior Machine Learning Product Scientist,2019-07-17,At Our Core We Are The Masters Of Combining Science And Business; Our Ideal Candidate Would Be Able To Do The Same With The Following ...,https://www.linkedin.com/jobs/view/senior-machine-learning-product-scientist-at-agoda-1358322769?position=6&pageNum=0&trk=guest_job_search_job-result-card_result-card_full-click,"AgodaChicago, IL, US 
",Mid-Senior level,Full-time,"Information Technology, Engineering",Internet
Capital One,"Chicago, IL, US","Senior Manager, Machine Learning Scientist - Fraud Detection",2019-07-25,"Still founder-led by Chairman and Chief Executive Officer Richard Fairbank, Capital One is on a mission to help our customers succeed by ...",https://www.linkedin.com/jobs/view/senior-manager-machine-learning-scientist-fraud-detection-at-capital-one-1348405894?position=7&pageNum=0&trk=guest_job_search_job-result-card_result-card_full-click,"Capital OneChicago, IL, US 
",Mid-Senior level,Full-time,Other,"Banking, Financial Services, Investment Banking"
Workbridge Associates,"Chicago, IL, US","Data Scientist (Machine Learning, Deep Learning)",2019-04-17,What You Will Be Doing. The ideal candidate will have some sort of software engineer background with Machine Learning algorithm ...,https://www.linkedin.com/jobs/view/data-scientist-machine-learning-deep-learning-at-workbridge-associates-1266738127?position=8&pageNum=0&trk=guest_job_search_job-result-card_result-card_full-click,"Workbridge AssociatesChicago, IL, US 
",Entry level,Contract,"Engineering, Information Technology","Information Technology and Services, Computer Software, Financial Services"
Salesforce,"Chicago, IL, US",Machine Learning/ Deep Learning/ Data Scientist (Product Development - Sr./Lead/Principal),2019-07-26,"We are looking for people who are excited about different and unique data sets, and all the ways that they could be used in order to ...",https://www.linkedin.com/jobs/view/machine-learning-deep-learning-data-scientist-product-development-sr-lead-principal-at-salesforce-1292786901?position=9&pageNum=0&trk=guest_job_search_job-result-card_result-card_full-click,"SalesforceChicago, IL, US 
",Not Applicable,Full-time,Other,"Computer Software, Information Technology and Services, Internet"
"Envestnet, Inc","Berwyn, IL, US",Software Engineer/Machine Learning Engineer/Data Scientist,2019-07-05,The Envestnet co-op program is designed to provide selected Drexel undergraduates the opportunity to learn about the company and gain ...,https://www.linkedin.com/jobs/view/software-engineer-machine-learning-engineer-data-scientist-at-envestnet-inc-1402712483?position=10&pageNum=0&trk=guest_job_search_job-result-card_result-card_full-click,"Envestnet, IncBerwyn, IL, US 
",Entry level,Full-time,"Engineering, Information Technology",Financial Services
Boston Consulting Group (BCG),Greater Chicago Area,Senior Machine Learning Engineer,2019-06-21,"Senior Machine Learning Engineer- BCG GAMMA 
BCG Gamma designs and builds powerful analytics-based solutions designed to help our clients ta",https://www.linkedin.com/jobs/view/senior-machine-learning-engineer-at-boston-consulting-group-bcg-1224547487?position=11&pageNum=0&trk=guest_job_search_job-result-card_result-card_full-click,"Boston Consulting Group (BCG)Greater Chicago Area 
Senior Machine Learning Engineer- BCG GAMMA  
BCG Gamma designs and builds powerful analytics-based solutions designed to help our clients tackle their most pressing business problems. We are an interdisciplinary team of data scientists and BCG consultants, collectively delivering a unique combination of domain expertise, analytics know-how, and leading technologies. Our teams own the full analytics value-chain end to end: framing new business challenges, building fact-bases, designing innovative algorithms, creating scale through creating tools and apps, and training colleagues and clients in new solutions. BCG Gamma is a global capability, working with clients in every BCG region and in every industry area. The team partners with BCG practices, including Operations and Marketing, Sales, and Pricing. Gamma is a core member of a rapidly growing analytics enterprise at BCG – a constellation of teams focused on driving practical results for BCG clients by applying leading edge analytics approaches, data, and technology.  
OVERVIEW OF GAMMA ENGINEERING:The Gamma Engineering team is building the next generation of analytics tools. With your help, Gamma will develop a platform that fuels BCG Gamma‘s global data and analytics offerings. Data scientists depend on easy to use interfaces to easily code, increase productivity, answer questions, and envision their results. Clients need to easily interact with our analytics applications to measure the success of their new analytics enabled organization or quickly make decisions based on what and how they see analytic output. Our clients will use our analytics solutions to derive insights around business trends. We “open the doors” to data for our clients giving them fast and trusted options to search, frame, and share data. Gamma’s goal is to help our clients understand what their data means and provide them the tools to share its narrative with various audiences.  
POSITION SUMMARY:BCG Gamma is seeking a Senior Machine Learning Engineer to join our Gamma engineering team. The ideal candidate will have industry experience working on a range of different Machine Learning disciplines, e.g. Anomaly Detection, payment fraud, fraud detection, search ranking, text/sentiment classification, spam detection and others. The position will involve taking these skills and applying them to some of the most exciting and massive data and analytics problems across multiple industries. We are looking for machine learning engineers to join the ML effort for our teams, building ML-based systems, tools, and services that serve as infrastructure for our internal and external clients.  
As a strong software leader and an expert in building complex systems, you will be responsible for inventing how we use technology, Machine Learning, and Data to enable the productivity of our clients. You will help envision, build, deploy and develop our next generation of data engines and tools which will help our clients fundamentally transform their business. You will be bridging the gap between business and engineering, and functioning with deep expertise in both worlds.   
  
BASIC JOB RESPONSIBILITIES:We are looking for a Machine Learning Engineer who can bring bleeding edge machine learning models into production together with a highly multi-disciplinary team of scientist, engineers, strategic partners, product managers and subject domain experts.  
BASIC JOB REQUIREMENTS:  
BCG is an Equal Employment Opportunity Employer and is committed to a policy of administering all employment decisions and personnel actions without regard to race, color, religion, sex, sexual orientation, gender identity / expression, pregnancy, national origin, age, physical or mental disability, marital status, veteran status, or any other category protected under applicable federal, state, or local law  
  
",Mid-Senior level,Full-time,Information Technology,"Management Consulting, Computer Software"
Big Cloud,Greater Chicago Area,Data Scientist,2019-07-31,"They are seeking to recruit a Data Scientist. Big Data / real-time data processing platform experience (Spark, Hadoop, Flink, etc) Are ...",https://www.linkedin.com/jobs/view/data-scientist-at-big-cloud-1403946512?position=12&pageNum=0&trk=guest_job_search_job-result-card_result-card_full-click,"Big CloudGreater Chicago Area 
 
Are you a Data Scientist with client facing experience? Can you design and deliver machine learning solutions to clients? Do you want to work or one of the hottest AI companies?  
   
One of the worlds most successful AI companies is expanding their customer facing solutions and services practice. They are seeking to recruit a Data Scientist.  
   
You'll be responsible for managing client data science projects including; demonstrations, developong proof of concepts, managing success criteria and training users.  
   
Other responsibilities will include:  
  
You'll have…  
  
Ideally…  
",Mid-Senior level,Full-time,"Information Technology, Engineering",Computer Software
"Technomic, Inc.",Greater Chicago Area,Data Scientist,2019-07-29,"We are searching for an ambitious, career-oriented Data Scientist to join our Research & Insights team out of our Chicago office! The ...",https://www.linkedin.com/jobs/view/data-scientist-at-technomic-inc-1344651741?position=13&pageNum=0&trk=guest_job_search_job-result-card_result-card_full-click,"Technomic, Inc.Greater Chicago Area 
 
Technomic provides foodservice clients around the globe with the research, insights and strategic consulting support they need to enhance their business strategies, decisions and results. Our services range from major research studies and management consulting solutions to online databases and simple fact-finding assignments.  
  
We are searching for an ambitious, career-oriented Data Scientist to join our Research & Insights team out of our Chicago office!  
  
  
Responsibilities:   
Leverages analytical skill set to access data from       multiple data sources for ad hoc analysis, data visualizations and       predictive modeling  
Research and utilize a variety of machine       learning models and predictive methods to help deliver meaningful insight  
Independently develop code in R/Shinyapps to support       predictive & prescriptive modeling   
Develop analytic web applications and simulators using       R and other dashboard tools  
Develop and maintain analytic work flows in Alteryx to       support predictive modeling and advanced analytics  
Understand existing code to support ongoing analytic       applications  
Write  robust code to clean, organize, and investigate messy data  
Update, maintain and document existing predictive       models and/or R Shiny apps  
Collaborate with Research & Insights, Product       Development, IT and other teams to conceptualize and implement analytic       products from start to finish  
  
Knowledge, Skills, Abilities:  
1-2       years of related professional experience   
Expert level programming in R/Shinyapps  
Prior experience creating predictive models in Alteryx       a plus  
Proficient in Microsoft Excel (pivot tables, power       pivots, v-lookup)   
Web development experience a plus  
Experience working with large databases a plus  
Experience working with transactional data a plus  
Must have attention to detail, as well as strong       analytical and problem-solving skills   
Proven ability to manage multiple tasks and meet       deadlines   
Demonstrated ability to learn new programming       languages and tools with minimal guidance   
Master’s or PhD in Computer Science, Statistics,       Mathematics, Engineering, Economics or a quantitative discipline       required  
Must be a US Citizen or US Permanent Resident       authorized to work without sponsorship  
  
Technomic is an Equal Opportunity Employer. Technomic does not discriminate on the basis of race, religion, color, sex, gender identity, sexual orientation, age, non-disqualifying physical or mental disability, national origin, veteran status or any other basis covered by appropriate law. All employment is decided on the basis of qualifications, merit and business needs. 
",Associate,Full-time,"Analyst, Information Technology","Market Research, Food & Beverages, Retail"
Evive | goevive.com,"Chicago, IL, US",Data Scientist,2019-06-29,Are you one of us? Evive is looking for a data scientist to join our product and engineering team in Chicago. We're looking for an ...,https://www.linkedin.com/jobs/view/data-scientist-at-evive-goevive-com-1349843660?position=14&pageNum=0&trk=guest_job_search_job-result-card_result-card_full-click,"Evive | goevive.comChicago, IL, US 
",Entry level,Full-time,"Engineering, Information Technology","Marketing and Advertising, Computer Software, Internet"
NICE Actimize,"Chicago, IL, US",Data Scientist,2019-06-29,"This role provides ample opportunity to flex and improve your NLP, optimization, and customer segmentation skills. At Mattersight we help...",https://www.linkedin.com/jobs/view/data-scientist-at-nice-actimize-1348603596?position=15&pageNum=0&trk=guest_job_search_job-result-card_result-card_full-click,"NICE ActimizeChicago, IL, US 
",Entry level,Full-time,"Engineering, Information Technology","Information Technology and Services, Computer Software, Financial Services"
Computation Limited,"Chicago, IL, US","Postdoc Position in Expanding Machine Learning Beyond Social Prediction to Explanation, Intervention",2019-03-22,"Experience with some of the following will be helpful: causal analysis, deep neural networks, Bayesian inference, probabilistic ...",https://www.linkedin.com/jobs/view/postdoc-position-in-expanding-machine-learning-beyond-social-prediction-to-explanation-intervention-at-computation-limited-1224983287?position=16&pageNum=0&trk=guest_job_search_job-result-card_result-card_full-click,"Computation LimitedChicago, IL, US 
",Entry level,Full-time,"Research, Analyst, Information Technology","Information Technology and Services, Computer Software, Research"
UL,"Northbrook, Illinois",Data Scientist,2019-07-30,The Predictive Modeling and Analytics Group at UL is looking for a data scientist/machine learning expert to deliver trustworthy insights...,https://www.linkedin.com/jobs/view/data-scientist-at-ul-1390725268?position=17&pageNum=0&trk=guest_job_search_job-result-card_result-card_full-click,"ULNorthbrook, Illinois 
The Predictive Modeling and Analytics Group at UL is looking for a data scientist/machine learning expert to deliver trustworthy insights for a variety of projects.  Ideal team member must have the mathematical and statistical expertise with a strong self-motivation to stay informed about the latest trends in the discipline. The Data Scientist will support global team projects and be hands on in the entire process from data prepping to exploratory data analysis to modeling building and validation.  
  
",Associate,Full-time,Other,Public Safety
QuantumBlack,"Chicago, IL, US",Principal Data Scientist - QuantumBlack,2019-07-17,Healthcare Efficiency– We helped a healthcare provider improve their clinical trial practices by identifying congestion in diagnostic ...,https://www.linkedin.com/jobs/view/principal-data-scientist-quantumblack-at-quantumblack-1358350563?position=18&pageNum=0&trk=guest_job_search_job-result-card_result-card_full-click,"QuantumBlackChicago, IL, US 
",Entry level,Full-time,"Strategy/Planning, Consulting, Information Technology","Semiconductors, Information Technology and Services"
Ethosia,"Chicago, IL, US",Deep Learning Researcher - Chicago,2019-07-02,"Use your creativity, imagination, and skills to transform the way businesses solve day-to-day operational challenges. Strong analytical ...",https://www.linkedin.com/jobs/view/deep-learning-researcher-chicago-at-ethosia-1376858857?position=19&pageNum=0&trk=guest_job_search_job-result-card_result-card_full-click,"EthosiaChicago, IL, US 
",Associate,Full-time,Other,"Information Technology and Services, Computer Software, Internet"
Capgemini,"Chicago, IL, US",Artificial Intelligence - Analytics Data Science Senior Consultant - Chicago,2019-07-05,"Required Skills And Experience. Experience with common data science tools such as Python, R, Pytorch, TensorFlow, Keras, NLTK, Spacy, or ...",https://www.linkedin.com/jobs/view/artificial-intelligence-analytics-data-science-senior-consultant-chicago-at-capgemini-1355382732?position=20&pageNum=0&trk=guest_job_search_job-result-card_result-card_full-click,"CapgeminiChicago, IL, US 
",Not Applicable,Full-time,Other,"Information Technology and Services, Management Consulting, Outsourcing/Offshoring"
ThinkMarkets,"Chicago, Illinois",Marketing Data Scientist- Chicago,2019-07-10,ThinkMarkets are looking for an experienced Marketing Data Scientist to apply statistical and machine learning models to drive investment...,https://www.linkedin.com/jobs/view/marketing-data-scientist-chicago-at-thinkmarkets-1348364999?position=21&pageNum=0&trk=guest_job_search_job-result-card_result-card_full-click,"ThinkMarketsChicago, Illinois 
ThinkMarkets are looking for an experienced Marketing Data Scientist to apply statistical and machine learning models to drive investment decisions for ThinkMarkets’ marketing budget.  
   
In this role, you will be responsible for forming quantitative models and developing actionable analytical solutions that will inform decisions across ThinkMarkets’ marketing budget, accelerating both demand and supply growth. The Marketing Data Scientist will be in charge of raising the understanding of how marketing contributes to our objectives, identifying and measuring the performance drivers for all marketing activity, modelling future results and optimising the effectiveness of marketing activity. In this role, you will devise and implement experiments to explore new ways to deliver measurable performance gains and help to establish and foster an outcome-orientated and evidence-led culture based on sound scientific principles  
   
This role leads and implements the longer-term strategy for marketing science, shaping a new approach to analysis, championing the blended use of data, technology and customer insight and ensuring the whole of Marketing uses what we learn to drive greater effectiveness and keep our customers at the centre of what we do.  
   
The right person for this role will have a passion for leveraging large scale data analysis, predictive modelling, machine learning, experimentation and technology to power decisions across our marketing investment.  
   
   
Responsibilities:  
   
   
You will:  
   
   
   
Requirements:  
   
",Mid-Senior level,Full-time,"Marketing, Information Technology, Finance","Financial Services, Information Technology and Services, Banking"
Shirley Ryan AbilityLab,"Chicago, IL, US","Data Scientist - ENTERPRISE DATA ANALYTICS, Full-time",2019-04-24,"The ideal candidate loves data, demonstrates a growth mindset with continuous learning, possesses an interest in the intersection of ...",https://www.linkedin.com/jobs/view/data-scientist-enterprise-data-analytics-full-time-at-shirley-ryan-abilitylab-1234469321?position=22&pageNum=0&trk=guest_job_search_job-result-card_result-card_full-click,"Shirley Ryan AbilityLabChicago, IL, US 
",Entry level,Full-time,"Engineering, Information Technology","Nonprofit Organization Management, Health, Wellness and Fitness, Hospital & Health Care"
Amazon Web Services (AWS),"Chicago, IL, US",Data Scientist - Nationwide Opportunities,2019-07-21,"If you have experience with AI, including building ML or DL models, we’d like to have you on our team. Combination of deep technical ...",https://www.linkedin.com/jobs/view/data-scientist-nationwide-opportunities-at-amazon-web-services-aws-1331946438?position=23&pageNum=0&trk=guest_job_search_job-result-card_result-card_full-click,"Amazon Web Services (AWS)Chicago, IL, US 
",Not Applicable,Full-time,"Consulting, Information Technology, Engineering","Computer Software, Information Technology and Services, Internet"
Catalina USA,"Chicago, IL, US",Lead Data Scientist,2019-08-01,"Ph.D. in machine learning, computer science, engineering, mathematics, statistics, operations research, or related discipline AND 5+ ...",https://www.linkedin.com/jobs/view/lead-data-scientist-at-catalina-usa-1406290550?position=24&pageNum=0&trk=guest_job_search_job-result-card_result-card_full-click,"Catalina USAChicago, IL, US 
",Mid-Senior level,Full-time,Other,Marketing and Advertising
"SMS Assist, L.L.C.","Chicago, IL, US",Principal Data Scientist,2019-03-07,"This individual is responsible for developing the big data strategy, building the data science team that will focus on implementing and ...",https://www.linkedin.com/jobs/view/principal-data-scientist-at-sms-assist-l-l-c-1177963042?position=25&pageNum=0&trk=guest_job_search_job-result-card_result-card_full-click,"SMS Assist, L.L.C.Chicago, IL, US 
",Entry level,Full-time,"Engineering, Information Technology","Information Technology and Services, Computer Software, Financial Services"
Lawrence Harvey Search & Selection Limited,"Alpharetta, Georgia",Leading Data Scientist- Special Projects,2019-07-29,Ideal candidates enjoy day-to-day data science problem-solving mixed with high levels of customer interaction. My client’s technology ...,https://www.linkedin.com/jobs/view/leading-data-scientist-special-projects-at-lawrence-harvey-search-selection-limited-1344574240?position=1&pageNum=0&trk=guest_job_search_job-result-card_result-card_full-click,"Lawrence Harvey Search & Selection LimitedAlpharetta, Georgia 
Easily apply to this job by creating a LinkedIn profile. This will only take about 3 minutes. 
Sign in to apply for this job with your LinkedIn profile. 
We will use your resume to quickly build your profile and apply to this job. 
Easily apply to this job by creating a LinkedIn profile. This will only take about 3 minutes. 
Sign in to apply for this job with your LinkedIn profile. 
We will use your resume to quickly build your profile and apply to this job. 
Leading Data Scientist- Special Projects- Atlanta, Georgia or Dallas, Texas  
   
I have a magnificent opportunity with a top tier AI, Machine Learning, Deep learning, and Advanced Analytics Firm that is changing the world by being the most advanced enterprise machine learning platform.  My client’s technology captures the knowledge, experience and best practices of the world’s leading data scientists, delivering unmatched levels of automation and ease-of-use for machine learning initiatives.  My client’s technology enables users to build and deploy highly accurate machine learning models in a fraction of the time.  
   
They are looking to add a Data Scientist-Special Projects- to their team to work on unique project initiated by the CEO and is confidential at this point.  These projects will involve analyzing and interpreting big datasets with Pyspark  
   
As a Leading Data Scientist your work will involve many real-world problems. The candidate should ex machine learning expert with in-depth knowledge of structuring big data.  
   
The individual must have experience driving large scale advanced data science projects to completion from end-to end, leveraging a wide array of Machine learning techniques.   Ideal candidates enjoy day-to-day data science problem-solving mixed with high levels of customer interaction.  
  
Main Requirements  
§  4-10+ years of relevant work experience on data science projects  
§  Expertise with Python  
§  Experience working in a Pyspark or Spark environment  
§  Working onsite full-time with a customer  
§  Hands-on experience building and implementing predictive models  
§  Experience with machine learning techniques  
§  Problem solving ability using Machine Learning Techniques  
§  Strong understanding of applied statistics and data mining/munging techniques  
§  Excellent organizational, communication, writing and interpersonal skills  
   
 Desired Skills  
§  Consulting experience  
§  Familiarity with Hadoop and related Big Data technologies  
§  Familiarity with a variety of technical tools for the manipulation of datasets  
§  Data visualization  
   
  
",Associate,Full-time,"Information Technology, Analyst, Marketing",Staffing and Recruiting
Quest Groups LLC,Greater Atlanta Area,Senior Data Scientist - Product Analytics,2019-07-17,"Research or expertise in one or more of the following: User Experience Research, Natural Language Processing, Hierarchical/Multilevel ...",https://www.linkedin.com/jobs/view/senior-data-scientist-product-analytics-at-quest-groups-llc-1357081541?position=2&pageNum=0&trk=guest_job_search_job-result-card_result-card_full-click,"Quest Groups LLCGreater Atlanta Area 
Easily apply to this job by creating a LinkedIn profile. This will only take about 3 minutes. 
Sign in to apply for this job with your LinkedIn profile. 
We will use your resume to quickly build your profile and apply to this job. 
Easily apply to this job by creating a LinkedIn profile. This will only take about 3 minutes. 
Sign in to apply for this job with your LinkedIn profile. 
We will use your resume to quickly build your profile and apply to this job. 
Senior  Data Scientist - Product Analytics   - in Atlanta OR REMOTE  
  
Strong working knowledge of research methodology and statistical techniques including experimentation, statistical inference, and machine learningExperience performing advanced data analytics in a business, academic, or related context (e.g., high-tech, market research, management consulting, operations research, finance, etc.)Ability to explain value of different analytic methods, and the output of data analyses, to non-technical audiences, including executives and managers  
5 years of experience as a high-performing Data Scientist on a product team, including mentorship of more junior team members. Formal management experience preferred  
Bachelor's degree in quantitative field, advanced degree preferredSignificant coding experience with data/statistical packages (eg. SQL/Hive, R, Python (Pandas + Statsmodels + Scikit-learn), Pig, Julia, D3.js)Research or expertise in one or more of the following: User Experience Research, Natural Language Processing, Hierarchical/Multilevel Regression, Data Visualization, Deep Learning, Social Network Analysis, etc. 
",Mid-Senior level,Full-time,Engineering,Computer Software
